,lem_text,y_true,pred_y,pred_probs,c_matrix
1976,online international bank account background live third world country currency devalues every hour national bank could save almighty dollar said traveled state created bank account used year someone tried log go person get back personal reason cant next year recently found online bank willing give bank account little digging find info bank webpage little social medium influence twitter created come question online bank trustworthy,0,0,0.37743454444209984,TN
463,morgan stanley purchase eaton vance billion morgan stanley said buying fund manager eaton vance billion day completing takeover discount broker e trade financial corp continuing firm shift away trading toward steadier simpler business like money management boston based eaton vance founded brings billion asset bulk morgan stanley undersized presence bond sustainable investing eaton vance shareholder receive share cash stock roughly premium fund manager closing price wednesday likely raise morgan stanley investor eyebrow,1,1,0.8185522773159848,TP
1955,university rep want switch vanguard axa university give u free meeting financial adviser every year recent meeting started trying convince switch roth ira vanguard axa employer imagine provide service free university asserting roll ira vanguard axa boarding fee expense ratio fund vanguard additional loss protection offer perk missing something worth fund potential future business sure loss protection enough activation energy overcome inertia switching provider definitely want make sure going extra fee going try sneak,0,0,0.12368300612507796,TN
614,would happen major tech stock apple amazon facebook etc company get broken lot talk antitrust recently believe support would happen company get broken never seen major company get broken example facebook make instagram separate company based law would instagram stock would current facebook share reduced would gain instagram share,1,1,0.9534678488506416,TP
376,best etf mutual fund take advantage green new deal whatever portion might come fruition poll pointing biden harris win case renewable green energy likely see new government subsidy huge push new infrastructure epa standard probably returned pre trump guideline portion green new deal likely undertaken full deal might put practice fraction trillion spent project job company like invest company en masse anticipation plenty solar etf great renewable energy mutual fund ton socially responsible fund one fund exposed massive amount spending others anyone done research maybe come small group fund going see trillion dollar thrown holding next year watched tan go last week know likely start must much missing thank,1,0,0.41390809753983915,FN
2595,financial advice uk help buy isa lifetime isa looking use contribute towards deposit first time home hi f saving help buy isa present well partner give u k bonus use towards deposit maxed k saving found lifetime isa give contribution annually use housing deposit onwards without paying charge thing read faq say use different government scheme long eligible say anything using help buy isa lifetime isa time first time buying house deposit allowed feel free ask question provided right info anything else thought thank much,0,0,0.21734675453443242,TN
2109,take loan engineering bachelor degree good morning mentally back forth student loan year glad take first fourth year college last year transferred liberal art degree engineering decided engineering degree leaning towards mechanical go local college come semester k year work full time moment making k year full time hr plus commission commission regular sustainable year wondering class get harder take loan order fast track graduation break career since graduated high school parent put always worked full time trying go school pay everything medical insurance able join fraternity get college experience cost time school little older detached fraternity party lifestyle living girlfriend evidently want start living life post college feel like end sight whereas girlfriend already career year older spent last year catching math science could engineering carrying full course load summer order reach finish line faster lost direction take question dive fully school try maintain balance,0,0,0.07106183318381724,TN
1426,pro con automatic bank transfer pay bill especially security usa credit card info stolen spooked detected fraudulent charge canceled card ordered new one know exactly happened guy talked credit union said likely thing happened online retailer account hacked hacker gotten credit card info name phone number responsible credit card user pay full every month overspend made list place make monthly payment using credit card include monthly internet bill car insurance patreon several charity considering changing maybe monthly payment use direct bank transfer rather go credit card charity even say prefer cheaper fee end thing worried consequence another online retailer hacked way happens hacker bank account info rather credit card info matter pro see need manually change credit card number change either expires cancel set forget also charity support able money con get credit card reward cash back security issue already mentioned thanks advance step walk replying right away later evening,0,0,0.028825409122939218,TN
2329,think need new car lot time deal looking objective input alright looking advice hopefully allowed little stressed today certainly help apology make sense please let know info would useful civic hybrid k mile ima hybrid battery replacement light came today called dealer confirmed total cost replace absurd use put towards new car talked people two camp get new er car problem battery still cheaper new vehicle personally concern car quite time expecting day come unsure think important note work remotely barely drive however coming soon several somewhat long distance drive deal next month half time follow giant pf perfect car buying guide process take place far longer timeline thought may useful kind want new car gonna lie partially get rid stress thinking one gonna break anyday want spend k would prefer k would payment least price debt recurring bill rent near boston cheap bad le gross pay per month covid expense virtually nothing said attempting save house would absolutely impact plan looking like likely way thing going theoretically comfortable getting used civic open suggestion reliable car look gas efficiency amp comfort nice much prefer smaller car big weightier one sure information could provide would help looking input happy add post needed apology adding yet another help buy car post pile thank,0,0,0.0919331333433266,TN
2118,roth ira marriage getting married next weekend extra layer stress freaking roth ira based income alone planning maxing roth ira contribution year get k everything going planned figured would stop contributing ass contribution officially married read something saying considered married whole tax year even though getting married september income top mine way max income think allowed contribute roth ira whole year k account year dont know anyway move different retirement account without penalty proud putting money away scared losing bunch hard earned money know begin fix situation get worse anyone lend level head predicament,0,0,0.05766864962318363,TN
594,k pop group bts label big hit entertainment ipo raise million reuters korea herald according bloomberg south korea largest ipo year despite cancellation global tour due covid big hit reported billion sale billion operating income first half year people think ipo affected enthusiasm fanbase likely jump chance piece label zero prior experience interest investing especially international fan scrambling figure invest foreign stock,1,1,0.9000861351200105,TP
1622,checking account well fargo want buy something slightly grand best way save get job hopefully hour going save grand currently credit card linked dad account barely use debit card need fixed currently idk go towards purchase sit best way buy something planning paying front paying year smart,0,0,0.051969122274120566,TN
107,company supplier directly impacted covid closure interested investing company impacted covid ie theater theme park arcade etc whose stock price depressed may rebound acquired due depressed stock value next year cnk amc play dboxf example low stock value except play potential huge multiple upside rebound course downside risk due business shutdown thought others may tracking,1,1,0.9844114255669116,TP
2737,obsessed retirement deal basically stop thinking retirement financially secure save every single dime invest live well beneath mean barley open wallet anything put gas car feel like everything spent money past waste money point need save retirement girlfriend parent busted ass year work force retired nothing job house car stable secure life working entered system poverty rely kid take care scared going end like first time seen happen crowd neighbor retired police officer whole career cop retired got job post office another year said pension something even living pay check pay check coming salary around k believe wife retired much exist go doctor office biggest fear end like couple stock investment account k saving account basically give quarter paycheck play month prepping hit feel like going come sooner imagine make girlfriend save money overreacting feel like none friend even think year head much le,0,0,0.027304053722636196,TN
2413,full time job asking part time work small gym athletic development facility pennsylvania salaried employee business got word one big high school contract able bring u back lost contract employer reducing full time job part time hour week sure unemployment table look second job supplement income advice greatly appreciated,0,0,0.09442947138866759,TN
906,new catalyst uranium sector horizon research report kazatomprom announcement japanese restarts getting tired hearing uranium yet sincerest apoligies feel free skip post leave obligatory stop pumping uranium nuclear power terrible comment door another update series post uranium sector sector asymmetrical risk reward opportunity current market brining yet another update partially present link direct whole library different analysis report uranium industry whole specific company sector different report previous year search whatever specific thing looking read away link however definitely reason writing another update past year lot analyst uranium sector best example rick rule saying restart japanese nuclear power plant would signal start new bull market sector year passed uranium bull case plenty catalyst get going kazatomprom cameco mine closure supply cut coming year kazatomprom part increased number new power plant constructed planned asia significant new mine coming online support nuclear energy u several add bull case describing previous post restart several japanese nuclear reactor joined growing list catalyst reported although seem like much change grand scheme thing one remember japan still significant uranium fuel reserve used fuel nuclear reactor decreasing global uranium supply bringing new demand back online since restarts power plant typically require significant amount new fuel start power production building new core restarts add increasing supply deficit portrayed cameco time different people predicting thing happen year changed get exactly people ask skeptical rightly people saying since different however mentioned report japan restarting faster anticipated mentioned widely seen thing light fire sector change bull case already convincing enough opinion add yet another catalyst list charge bull case many expected japan take several year start bringing back nuclear power plant nice boost sector one many analyst take direct account calculating ever increasing supply deficit even reactor still offline japan amount electricity generated nuclear power plant around world back level seens since tldr restart japanese nuclear power plant big positive uranium sector around time already several catalyst present extremely compelling bull case demand increasing supply cut world biggest producer kazatomprom deficit growing spot price uranium soon increase incentivize new production disclaimer make sure due diligence always consider risk tolerance level picking stock especially uranium sector question doubt answered one previous post whether post comment answered,1,1,0.6957659435333452,TP
1742,rejected auto loan due insufficient credit history despite year credit history including previous month car loan hello recently applied k auto loan rejected aforementioned reason thing active credit card previous auto loan belt credit score culmination year credit experience point insufficient data error credit union applied particularly tough standard follow question applying elsewhere hurt credit score even worse go,0,0,0.032686634320565885,TN
432,advanced micro device advanced talk buy rival chip maker xilinx said people familiar matter deal could valued billion link tweet wsj gt advanced micro device inc advanced talk buy rival chip maker xilinx inc according people familiar matter deal could valued billion mark latest big tie rapidly consolidating semiconductor industry gt company discussing deal could come together soon next week people said guarantee get especially given talk stalled recently restarting according people gt amd market value top billion share soared year coronavirus pandemic stokes demand pc gaming console device use company chip second quarter revenue rose billion net income jumped fourfold million back record notebook server processor sale amd said gt surge amd share could embolden company make acquisition using stock currency xilinx market value billion share far year ahead amp p rise gt typical takeover premium deal would value company billion gt amd based santa clara calif led chief executive lisa su addition desktop notebook computer make component used gaming system xbox playstation high demand pandemic force people stay home also growing data center processor business increasingly rival intel corp long dominant player segment gt addition xilinx led ceo victor peng would put amd even competitive footing intel give bigger position fast growing telecommunication defense market gt san jose calif based xilinx chip used wireless communication data center industry automotive aerospace share hurt trade tension u china namely trump administration limitation shipment china huawei technology co security concern analyst estimated huawei accounted roughly xilinx revenue gt xilinx make microchip called field programmable gate array fpgas unlike standard chip reprogrammed produced make valuable rapid prototyping fast emerging technology enough time go yearslong development process necessary chip gt fpgas commonly used new superfast g telecommunication infrastructure although may replaced later standard chip technology mature also often used military communication radar system gt intel main player fpga market built business acquiring altera corp gt amd specializes central processing unit serve computer digital brain gaining share intel recent year releasing new generation processor match beat larger rival many performance benchmark amd around share personal computer cpu second quarter according mercury research around three year ago gt consolidation swept semiconductor industry chip maker seek scale expand product portfolio support increasing number everyday item connected internet xilinx one considered number potential tie ups recent year come fruition gt amd xilinx reach agreement three year largest deal far would semiconductor industry according dealogic data analog device inc july agreed pay billion maxim integrated product inc nvidia corp september agreed pay billion arm holding british chip designer backed softbank group corp gt merger acquisition activity generally sluggish result pandemic announced global u volume respectively according dealogic lately however shown sign life company gain confidence make big strategic move nextera energy inc recently approached duke energy corp takeover proposal would likely value north carolina utility well billion count year largest deal gt activity confounded prediction looming election would cause deal maker sit hand awaiting clarity kind administration likely calling shot next four year,1,1,0.9489044645993674,TP
778,top philosophy investing new investing planning investing reading seem one clear winner term investing strategy business strong moat simple business fair price even slightly overvalued chief investor philosophy buffet one making money long term ex would never buy amazon google seem great business great management successful investing philosophy accommodate novel growth company tech,1,1,0.9177121213049726,TP
94,holding cash portfolio rainy day eg market correction argument pro con either keep cash holding hold cash invest similarly correction lot happen next week put cash work broad etf eg spy something niche eg arkk growth stock momentum take pick zm tsla shop etc beat value stock eg f ccl ual etc thanks edit wanted add pretty sure first post thank everyone take time reply forget entertaining wsv idiot say community great edit upped cash position plan hold around election time week away,1,1,0.7259453207491702,TP
745,passively managed index fund v etf taxable account apology asked although seem find specific answer scenario fully understand difference etf mutual fund confused taxable brokerage account understanding etf generally considered tax efficient better choice article say saying comparison actively managed mutual fund however index fund passively managed ex fxaix would also trigger capital gain therefore making effectively term tax benefit compared etf like spy know expense ratio differ someone find tax filing confusing main concern dealing tax implication choice would prefer invest index fund like fxaix taxable account purchase whole share spy spy trigger le capital gain obviously prefer go advice greatly appreciated,1,0,0.14049256214084552,FN
37,tesla bull case enormous advantage much tesla people speak agree earn time car usual car company gasoline car still keep losing money ev tesla create self driving technology earn huge amount money using car robotaxies one near huge amount data collect insurance car earn billion fsd full self driving autonomous driving reduce car accident several year tesla going electricity grid company give another huge area area dominate ability innovate sell many car produce reduce price earn car reduce constantly production cost capacity grow k million car per year adding austin berlin enhancing shanghai others may added india talk waste money ad dealer expense go customer stock owner vertical integration reduces expense dramatically innovator figure car innovation significant innovation make car better parameter company succeed copy tesla huge technical advantage car company advantage growing tesla user fan understand amazing product similarly apple biggest company world tesla huge advantage battery cell patented time cheaper higher capacity last time longer amazing tesla creates battery level company even using battery cell others use,1,0,0.3543232002671438,FN
1357,anybody know really good economics book buy hello guy amp girl looking purchase great economics book read anybody know one looking one talk inflation supply amp demand currency stock market investing budgeting state amp federal tax price gouging etc anything relating economics thank,0,1,0.9576676501474236,FP
1339,afford rent hey pf year parent house girlfriend looking apartment n hcol area trying conservative focused bedroom place found anything great im wondering afford bump budget debt u drive paid camry lowish mile received master summer paid cash help work reimbursement currently grad school work reimbursement scholarship leaf little expense drive old camry likely buy car within next year follow estimated budget income saving income saving pre tax month k month misc saving hysa future house k hysa future ring wedding k hysa e fund k gf pre tax k month saving car fund k house fund k expense split rent grocery utility gym streaming internet insurance car apartment feed back appreciated,0,0,0.009187286130897233,TN
2830,small sum stock trading account open hi interested investing certain stock understand need join brokerage firm thinking fidelity vanguard interested active trading possibly year cycle le far tax go account best open roth ira traditional etc new investing trading already k setup interested changing mirror receiving additional small amount lt thinking leaving money invested long time thanks,0,0,0.3465937285483697,TN
2269,much homeowner insurance get everything cdn condo bought k bedroom bathroom q much insure globally worst case go flame rebuild everything scratch q much get personal property insurance estimated k really unsure new fridge range dishwasher washer dryer furniture find home plus tv pc etc one website say estimate k per room got k thanks,0,0,0.24694657692382047,TN
529,tsla september seen catalyst rich month stock c outline upcoming event could help stock credit suisse belief september month full potential positive catalyst tesla see four driver responsible continued run tesla stock retail stock split likely provided another boost retail interest tesla remains one added name robinhood demand outside u quant momentum market remains long momentum short covering tesla short interest lowest level since early passive wonder passive investor purchasing tesla advance amp p add amp p add may announced end week rebalance scheduled third friday sep sep announcement would occur two week prior sep course guarantee tesla included next add given challenge adding company tesla size precedent bn company added index believe many investor assume add month battery day sep lay case lot growth ahead investor setting high bar expect event highlight tesla tech advancement battery plan insourcing path capacity expansion expanding battery capacity x stand today broadly tesla likely demonstrate different lever reduce cost battery expect lay case significantly reduce vehicle cost ultimately unlocking lower vehicle asp pricepoints e perhaps showing tesla sell k vehicle thus tesla significantly expand unit sale yet note investor may treating battery day opportunity refocus position,1,1,0.9256602504537076,TP
2658,open another high yield saving account hello currently k hsbc high yield saving account due fluctuating rate interest rate dropped still better traditional bank comparing bank like vio marcus goldman sachs interest rate still money bofa account mainly emergency fund move rest vio marcus account move everything hsbc account since interest rate fluctuate anyway vio marcus account might drop rate future amp x b thanks advice,0,0,0.16834041838925715,TN
913,calculating implied default rate bond etf hello amp x b understand calculate probability default single bond like probability default credit spread recovery rate however interested calculating implied default rate etf would work adjust formula implied default rate credit spread recovery rate thank advance,1,0,0.4353659566394174,FN
262,u weekly jobless claim unexpectedly increase washington reuters number american filing new claim jobless benefit unexpectedly rose last week could heighten fear covid pandemic inflicting lasting damage labor market initial claim state unemployment benefit totaled seasonally adjusted week ended oct compared prior week labor department said thursday economist polled reuters forecast application latest week weak labor market resulting economic hardship major hurdle president donald trump chance getting second term white house american go poll nov former vice president joe biden democratic party candidate blamed trump administration handling coronavirus crisis worst economy least year seven month pandemic united state claim remain well peak great recession though record million march million people permanently lost job september another million unemployed six month white house congress struggling agree another rescue package business unemployed claim likely remain elevated ten thousand airline worker furloughed state local government budget crashed pandemic leading layoff expected escalate without help federal government high unemployment resurgence new coronavirus case across united state threaten economy recovery recession started february though economic activity rebounded third quarter fiscal stimulus stubbornly high jobless claim suggest momentum ebbed heading fourth quarter third quarter gdp growth estimate topping annualized rate economy contracted pace second quarter deepest decline since government started keeping record growth estimate fourth quarter cut low rate pace,1,1,0.6122038546935683,TP
