,lem_text,y_true,pred_y,pred_probs,c_matrix
2041,wanting move state need help figuring new tax budgeting afford higher col area hi everyone apologize advance long post f living texas single mother quite time biological father never paid child support ever expect receive payment either cost daycare almost always rent regularly lived paycheck paycheck two year got really good relationship moved together march year never asked help paying daycare split rent water electric help little financially significantly little one started kinder last month excited financial freedom since paying month daycare considering moving north quite time like heat humidity thought since employer hiring remotely due covid could get new job state choice colorado work company remotely tx lease end march make move co start working local office know co pay state income tax something texas also know rent much higher denver v san antonio trying figure much salary ask make sure expense covered trying use paycheck calculator online issue put current pay information texas many calculator coming higher tax actually paying concern try play pay colorado calculator give accurate information work tech company making year monthly bill discover car loan personal loan insurance gasoline electricity half water half grocery half rent half medical dental vision insurance employer last month paying month childcare able save money tax paycheck range really know hourly making hr occasionally work overtime never hour debt discover car loan personal loan saving account think ever k hoping change new job question later biggest monthly expense medical insurance san antonio diverse come tech job know denver boulder area really coming hoping find company either better health insurance rate find company pay premium employee found company offer process interview understand probably paying half rent moving colorado listed resume like make k one company offer free cost employee health insurance stated starting salary k slightly le making figure longer paying month health insurance still come ahead guidance solid resource properly calculate tax different state would appreciated amp x b edit formatting,0,0,0.016342930270690243,TN
1571,feel stuck lost career currently live wnc worked banking two year married love life f summer moved together wonderful employment banker recieved ba economics focus finance minored accounting recently however employer acquired merge resulted position demotion universal banker float line teller pay remains would otherwise issue climbing ladder new institution seems nigh impossible acquired employer working towards leaving retail banking moving commercial banking estimated path year present path new bank path put commercial three four year current work experience amount customer service account opening closing small lt personal loan origination head vault teller sale work sure much experience valuable outside banking concerning wife went back school master degree english fall placed bit stress relying income get planned bit pay bump year question least year plan remains feel like stuck job back square one option advancement beginning think banking best choice estimated annual net income estimated annual personal expense estimated annual share household expense wife estimated annual net income wife estimated annual personal expense wife estimated annual share household expense currently k employer saving cash wife vehicle car paid old mine paid two half year balance rent apartment try spend money outside necessary college loan debt wife slightly increasing due mind sure next step career would good avenue pursue thought going back school question present job offer friend mine salt lake city estimated annual net call center management wife keen moving area degree would much expensive attain sound choice,0,0,0.008505758576501404,TN
1380,trying advice v denigration married year spouse abusive gambler get rich scheme pawn came marriage determined repair financially among scheme ex borrow large amount student loan credit card debt additionally take large withdrawal roth ira subsequently abandoned trying repair credit ever since freely admit made bad financial decision asking non judgmental advice edit sorry lead personal info front last time posted asking financial advice people assumed debt crazy woman could control shopping habit tried provide specific info comment thank,0,0,0.04384053637398652,TN
2246,pay cut march actually pay cut try keep brief single man employed since sep starting pay week salary august changed salary hourly base hourly rate hour week week time company busy made lot overtime made difference plus working crazy hour noted person received change pay done tired working hour week minimum wage overtime compensation accepted change hourly naively first full time employment experience art screwed march pay cut company wide cut hourly rate meaning new base rate hr week week slim overtime potential effectively starting salary talked hr today expecting response within week feel cheated angry though like job enough blow chain command get kicked dirt end goal play get back cut would actually base hourly rate reflected base salary would mean would longer upside living expense bleed saving account personal investment account advice appreciated thank time,0,0,0.2566338468244175,TN
2130,credit card debt got credit card used jam notice bad interest rate year still trying pay thing called trying negotiate actually closed account said could cut card long issue negotiate interest rate double legal maximum state problem paying plow interest charge paying principle time suggestion anyone want credit card please pay attention anyone want give advice would really appreciate,0,0,0.024349072797623363,TN
1244,much income show purchase second home hcol combined current income k kid currently townhouse plan rent buy single family home nearby neighborhood ran plan financial advisor provided u following number figure seem low u would love second opinion much need saved purchase price k k closing cost moving expense k renovation etc purchase price k closing closts moving expense k reno etc purchase price k k closing moving expense k reno etc,0,1,0.6702619234600599,FP
2334,better file bankruptcy contact disability lawyer first hello live medical bill last two year result many er trip health insurance recently heart attack time fired three different job missing much work willing fight started receiving debt collection letter judgement court appearance sure next currently work applied ssi disability ohp denied currently job receiving income kind work worked miss lot work due pain pcos thyroid disorder gone untreated several year due able afford pocket medicine worry healthcare cost would consider filing disability,0,0,0.0631552163065003,TN
2741,landlord depositing rent check really bizarre recently moved new apartment security deposit first month rent paid via cashier check question send rent every month brought via text finally got answer day second month rent due dropped landlord building block away sent text letting know left read happened next month today dropped rent third check point taking video dropping rent check screenshots message email noting dropped rent trying get anything understand cashing check end goal ran neighbor today issue least know manage couple dozen property cash rent check never heard anything like confirm cashed cashier check money taken account month ago hate think sitting around long personal check valid continues cash liable late fee unpaid rent anything certainly want eviction record willfully paying fund checking account becoming pain keep track thanks,0,0,0.06869185186498511,TN
884,eli industry stock invest higher average inflation low interest rate understanding fed signaling higher average inflation continuation low interest rate foreseeable future case investment would benefit value v growth stock real estate reit utility etc would growth company take debt expand better value company,1,1,0.9592112387659298,TP
2404,buying home next couple year transfer money equity hi investment equity since pandemic scared long term recession set given awfully bullish current market constantly look like going crash looking buy place next year transfer investment money market similar saving year since started full time work recovered loss since crash sitting yield fyi canada money mutual fund manulife company plan end would call based risk appetite wanted hear opinion,0,1,0.6075045322958984,FP
2635,merrill edge v vanguard parking money voo hello long time lurker st time posting bank america customer opened merrill edge account planning put money voo may considered putting vti future planning buy single stock like use bc get consolidate finance place along checking saving credit card told best research fee park k merrill edge thing need worry tax end year always thought maybe buying voo directly vanguard better idea compare boa always hear dave ramsey youtube financial advisor say never invest money bank fee planning maybe wrong move money vanguard stay merrill edge currently ira tiaa roll merrill edge like bc finance consolidation also playing small sum money robinhood app currently k worth voo sell voo transfer money robinhood acct merrill edge buy voo directly thank advance,0,0,0.07709404833153906,TN
2056,backdoor roth ira conversion wife recently married using backdoor roth personal account prior marriage without problem traditional ira wife currently k traditional ira company able benefit write tax married income longer allow write since case want backdoor contribution want switch company b using year fact already money traditional ira worry pro rata rule contributes max contribution company b tira backdoor roth going complication pay tax conversion double taxed trying convert traditional ira money k roth new maximum yearly contribution put year,0,0,0.06424314619172485,TN
2079,balancing vehicle trade house payment truck worth paid looking switch suv would better fit family need sale price suv looking right around sale would essentially wash probably still owe little state trade like would result almost worth sale tax time saving house payment could finance car month ish credit score year history get straight cash truck would extra tax pay looking buy next year k would really accelerate ability buy would debt book affect home loan offering debt make plenty expendable income looking get accord instead drive wheel fall third option might split difference put half truck cash towards payment half towards house fund big flaw either plan forgetting,0,0,0.020743476293448602,TN
2152,order check first time want avoid bank bank america outrageous price buy check account routing number third party ask check number previous check never bought check idea put called bofa yesterday asked would start said question order third party check number still go even though never ordered check bank,0,0,0.47284452269625665,TN
1934,get dream apartment maximize disposable income saving starting new job income going way way k year gt k year state income tax medium col money go far big transition since two year ago income k year k year k etc dilemma always wanted live city high rise apartment obviously never money already got application approved apartment dreamed bonus whole structure including wall concrete steel neighbor noise much le issue current upstairs neighbor driven literally insane month loud stomping within walking distance new office downside month month parking fee really month lease sitting inbox waiting sign second thought covid much city anymore job work home least january imagine get extended summer still really like apartment occurred could get even bigger one nicer finish month suburb obvious downside amazing urban skyscraper view would wooden structure risk noise company go back office lease go awful commute many financial commitment single kid car loan payment month month insurance nearly paid left far issue peeling paint also considering taking comprehensive coverage car worth much anymore student loan payment month k total month federal loan currently paused due pandemic got k bank current level spending estimate month disposable income obviously save got month apartment v month got month apartment obviously getting saving priority though also k k worth stuff want buy new furniture mattress new pc new tv save rest looking estimate doable either way cheaper place get even money hit month living expense saving faster crazy go dream apartment look something cheaper,0,0,0.01276474879607996,TN
17,question reg buying selling stock within tax year buying selling random stock like tesla amd apple ect usually aim increase sell typically done sometimes month month still tax year worth capital gain tax make waste time made decent profit initial investment thats considering tax im gonna pay year advice would much appreciated,1,0,0.3227259431207587,FN
756,access equity analyst report looking additional resource research stock even something may pay access tend read morningstar analyst report looking report give price target narrative business outlook trend etc subscribe schwab goldman etc analyst report suggestion appreciated,1,1,0.8688116297158559,TP
188,value stock environment hello guy top value stock right fresh fund first time getting u market currently invested home country philippine planning move fund u market diversification also better choice took awhile able set account right base research feel like stock right expensive argue since environment low interest rate right sector company good look right defensive stock look attractive guy fresh fund something let sleep next year bagger guy eyeing style like practice value base investing since dont time actively trading investing company sound fundamental make sleep night market fall keen tech since valuation seems high moment unless company guy feel look currently cheap good track record,1,1,0.8887403549385542,TP
903,fear u eventually crumbling park money semi safe im young mid twenty investor decent sized windfall mm fear u dollar eventually crumbling life time tried read way protect asset devaluation dollar people suggest doomsday bunker gold historically evaluating power around world always changed without needing give rise doomsday bunker scenario demise greek macedonian roman mughal british empire scenario rather people starving surviving world economics changed another way besides gold food hoarding protect devaluation dollar devaluation u dollar possibility life time lt year want grow asset currently mm cash mm start charity abroad reasonable time frame thanks,1,0,0.21273425942571955,FN
648,shopify share price continue gain lockdown tradixa broker shopify share price impressive far stock around far year show sign slowing yet company also partnered facebook help business create virtual storefront social network surged almost time small business making switch online storefront coronavirus pandemic largely driving shopify share price gain lockdown easing across world shopify share price continue gain,1,1,0.9393028977375818,TP
1902,budget look year old fresh grad k saving bond continuing mature mature still grow couple year k federal student loan normal rate another k federal loan name le rate ignoring tackle loan live home little expense gross income k month tax k checking k saving expense dispersement roth ira saving student loan payment car payment gas insurance spending everyday expense going back school company dime mba next year hold back saving roth dump loan cash bond put towards student loan feel like saving may much since live stably home working month getting started waiting contributing k company match kick hope max know car expense seem high count necessity well entertainment expense car keep sane feel like poor great never really budget like please let know thanks,0,0,0.012401944953570049,TN
2332,zero credit need get apartment next month currently living parent house construction rather small want living month lived different apartment past year parent name finished school parent said longer co sign apartment never credit card never pay bill never student loan basically zero credit history make gross month take home tax year currently first job school applied apartment around cheaper option area denied every single one applied gotten secured credit card put credit every month plan use month instantly pay researching build score figure else willing anything build credit order build quickly thank reading hope get answer really stressing,0,0,0.007343997163715807,TN
2548,pay debt start saving little backstory blow saving order get car fixed would reliable transportation job ended pointless lost one job shutdown time debt skyrocketed thanks able pay hospital bill insurance barely covered previous debt paying back place slowly starting hopefully able regroup get back track question better saving working paying debt combination also still rent payment paying car also one debtor aggressive even though told situation paid back half debt already least feel like least pay back alleviate stress cause credit score sitting around getting debt consolidation loan question according credit union know debt keeping credit score also credit card worry paying okay saving everything fell apart problem sure best option right saving paying debt advice would great thank advance,0,0,0.007965752727174502,TN
1386,personal loan advice needed best place apply shop small personal loan first somewhere k k credit suck although steadily getting better last year make k year check bank first getting offer credit karma made think personal loan know show small sample available paid advertise company guessing best place start prefer something feel unbiased possible trust actually getting best deal overall thanks advance advice guidance welcome amp appreciated let know need detail order provide best advice,0,0,0.07413357757577244,TN
1040,prediction tesla still early inning first prediction reference let start vehicle tesla forefront technological ev revolution first mover advantage large arsenal capital behind dominate ev field moment tesla billion cash billion long term obligation may seem like problem however current share price tesla dilute even shareholder much better financial position additionally elon musk close third tranche performance bonus come play option purchase million share price add million tesla balance sheet tesla unique position release new line vehicle sell well certain market example cyber truck america create cheaper compact model europe china presence growing tremendously tesla backing ccp see tesla presiding position market leader ev space battery tesla purchase maxwell technology may secures role battery manufacturer creating battery vehicle house tesla improve profit margin forefront revolutionizing battery technology put tesla unique position manufacture battery also ev vehicle manufacturer yet untapped revenue source surely fruitful future super charger network tesla ev vehicle drive ny la using network supercharger station give tesla definite advantage ev relief range anxiety people may experience additionally building network cost billion dollar unlikely manufacturer undertake ev car become prominent ice car tesla open network manufacturer yet another untapped revenue source energy tesla energy business infantile stage set become revenue powerhouse next decade success australia demonstrated value add powerpack technology tesla installed mw battery farm store energy wind solar power source allows surrounding area affected temporary blip power outage ensures even distribution power across entire power grid technology underutilized world move towards solar wind vital california one example using solar wind power source caused rolling blackout issue implementation tesla battery plant thing past robotaxi network elon musk stated level autonomy possible tesla vehicle within year statement overzealous surely lv available sometime within next year happens tesla begin rollout robo taxi network become essentially another powerhouse revenue source propel tesla dominating conglomerate final thought exciting thing tesla surely still early inning tesla future company bring revolutionary mankind right forefront next valuable company earth capital position strengthened dramatically first mover advantage resource behind car manufacturer dream untapped revenue source innovation one visionary founder set forth backing government worldwide tesla car company conglomerate transportation energy market tesla revolution beginning friend,1,1,0.7491660624417564,TP
1507,possible buy house k salary coronavirus year unemployed tax income last year made k year possible buy house next year k find job month two mortgage loan base tax return current income work credit score debt income ratio going mortgage help know fha loan good option looking option available make possible tia,0,0,0.023853027752144675,TN
2600,grad school loan funding option usa considering going back school master economy bit tumultuous lost job due covid yay handle mask seriously panic minute going risk people wearing also feel capable working yes trying overcome far cigar remote position career seems like would pretty appropriate time get master degree mechanical engineering interested learning workplace believe degree bring much salary believe open lot door currently well hopefully bring degree self confidence refresh learn material kept feeling like missing last year work said considering option funding program assuming get obviously student loan option fortunate enough parent cover bachelor know many detail seems lot company program plan full time go plan done december credit program would need cover living cost well plus time finding job right unemployed fun textbook misc expense current financial standing previous salary k hoping job school k see k year living expense attempting keep low possible already living pretty frugally much cut k saving account using unemployed depleted time school start k roth ira k direct contribution understanding remove penalty free living expense must k k k remaining k mortgage last tax appraisal k rate mind refinancing believe employed estimated tuition book cost k depends many take per semester still determining summer course available would capable current plan would k tuition k seems like good starting estimate would need approximately k k tuition k next year living k year remaining k saving depleted wondering loan option investigate even worth considering anything house reverse mortgage home equity loan something worth tapping retirement account student loan rate typically low enough better leave retirement account alone know student loan big deal feel well financially would like approach least destructive way possible entire process really confusing fasfa work fully employed last year year playing around school calculator last year income estimate state grant year estimated income estimate state grant according fasfa estimator page graduate loan get k loan fasfa understand right anything excess need get another source rate onetime fee got full k loan understanding right also school tuition estimator show significantly le calculated actual tuition would cost added summer rate understand raise even spring fall semester summer calculated k claim k see say cover fee best guess fails include fee estimate information consider student loan let pay principal directly something need shop around wanting pay aggressively soon employed thank much,0,0,0.007500348233810925,TN
2040,inheriting parent house question best way pay warning wordy post ahead amp x b parent passed away earlier year estate still going probate hope settled next year little cash leftover due father nursing home dementia year k cash reduce continue pay expense attorney fee asset house need advice go holding financially smart way amp x b house property complete wreck think would still fetch around k sell want sell family since want completely gut renovate expand sqft could double based zoning allowance amp x b also family house one remaining grandfathered family house neighborhood currently tenant paying month apartment inside house apartment mother living vacant need cleaned condition rented also without putting significant amount money prefer moment reason amp x b parent home equity line credit borrow couple reason balance due need paid least longer name order settle estate amp x b best move regard pay cash house outright take loan hold onto cash use rental income pay new loan figure going term renovating house rent basically covering insurance tax expense house would probably clear month max actually would end going toward monthly payment would make new loan realistically would break even best likely pay bit pocket thought suppose would get money back yearly tax return since half housing expense property tax able written due rental unit amp x b renovation timeline unknown would peg within next year long tenant continue live pay rent idea would cost hcol area work priced accordingly take stab dark would guess least k probably even something would definitely need take loan amp x b wondering make sense hold cash take loan k pay home equity time eventually come renovation either pay loan get fresh one roll balance new loan amp x b pay house outright amp x b long term plan year renovate either move rent current house town stay rent renovated house much higher premium let say month maybe even also assuming rent house one family going explore option keep family put nd apartment garage something main house suitable family command rent smaller nd income studio apartment garage amp x b long long term plan year use studio apartment place one kid live college graduation continue rent house current house pas away two property one go kid,0,0,0.04123396739723261,TN
