,lem_text,y_true,pred_y,pred_probs,c_matrix
1151,hsa hdhp v ppo hsa money worth employer recently started charging hdhp longer contributing hsa monthly prescription wife regular office visit toddler toddler thing rack lot medical bill also possibility another child one thing wrap head around hsa fund tax free meaning yea bill higher money used worth meanwhile ppo saving tax money still technically spending losing share tax run number benefit comparison calculator ppo almost always cheaper get cost share limit k expensive however spend le max pocket extra contribution hsa keep seems like gamble hdhp hsa really one long contribute hsa right,0,0,0.08231800910808487,TN
2494,fsa overspent eligible cobra posted sub day ago finishing fsa leave job today read fsastore com may eligible cobra overspent fsa official site popular online store finish fsa balance spent k weekend stocking ricolas pad bandage medical device etc call employer verify hr know restriction never know something like get thrown,0,0,0.12222641511659159,TN
1693,employer withholding tax wrong state spouse live work co company ca make larger income filled two earner worksheet withholding paycheck federal co asked spouse employer withhold however spouse company instead withholding federal ca state well local city tax ca happening month asked fixed success question correct assumption paying tax problem could encounter january way get tax paid ca back think paying enough co tax suffer underpayment penalty liable company paying share tax co,0,0,0.2124881552927299,TN
1935,month lease dc apartment building looking time found great unit offering month free assume lower monthly price time lease trying decide month lease month lease would end nov would end march think would better taking larger per month discount month hope housing market still fairly low month go lock lower price longer effectively higher per month month lease wonder market basically fully recovered march ended spending needed locked much higher lease month,0,1,0.9236798241305973,FP
20,whats concensus reit sub often question like whats post covid play ccl dal etc etc mentioned imo nowhere near neccesity track record reit dividend long term investor remember watchinc reit aths thinking would great entrance point possibility never came march still alot quality reit sale im mean basic need ccl dal easily competed loose market share real estate cant really build top another prime real estate long src mac spg bxp avb,1,1,0.8409559888706172,TP
1593,year old k account need advice got fifteen thousand dollar checking account know going move saving wondering use invest money know want put atleast k saving reason say trying figure going make money make money know planning spending k personal spending guess question basically done hit k limit move forward k take right step k next year process looking new job way p also full time college freshman,0,0,0.018290268716192465,TN
78,motley fool next gen supercycle amp stock advisor service call fool spent money service year many year contemplation despite clickbaity sale pitch internet like probably take year give advisor service fwiw wanted share experience leap faith cheap started stock advisor promos paid year bit nail cursed way final submit button throwing away expecting anything say posting month later made shit ton recommendation period could picked symbol like delivered real human electronic feed went buy next gen super cycle paid promos still believe essentially paid small part gain already made stock advisor got one g spending time looking g know time get g portfolio imo quite eye opening wanted really add growth part portfolio needed research solid pick radar already getting confirmation help mentally pull trigger really company would never thought looking thinking g also fool service trader option player either bucket ignore post completely regular investor like like stay invested see multiply beat amp p many time honest opinion pricy gotten gain without ignore clickbaity ad style going hold back sane person worth,1,1,0.6819176551296492,TP
2911,helpful advice young person would offer often overlooked hi reddit community mid year old want make sure maximizing financial opportunity naturally turning vast community reddit help fortunate well paying job k year college debt good credit single fortunate idk thing currently would love hear anything else think maximize financial position future k set equal matched contribution saving account interest regularly invest stock etf amp mutual smart spending buying unnecessary thing else look think around k saved account amp stock thinking getting real estate eventually however young go opinion invest mortgage place likely move nyc soon pay around rent advice appreciated,0,0,0.10331426394467852,TN
804,dphc lordstown u ev boom dphc lordstown oh may next tesla ev truck backed wkhs amp gm produce new usps fleet mail truck entering full production next year business preorders amp market cap b undervalued ev play upside achieve b catch peer ev pre merger sitting great price news strike merger confirmed stock hit low amp continue soar job created ohio backed built property gm b brainer merger news day neglect gem opportunity,1,1,0.9359915320670203,TP
2122,help excel spreasheet financing hey everyone hope right place ask excel reddit group said plea help little making excell spreadsheet finance im struggling find way automatically add money getting every three month instead every month connected monthly amount cell change month tracker idea tell spreadsheet add increase amount automatically month number etc anybody suggestion,0,0,0.2700047240520872,TN
2478,take advantage federal student loan extension pay kind conflicted trump administration extended student loan interest rate suspended payment federal student loan dec st already set aside significant chunk money given expected start paying loan november graduated past may knee jerk reaction put chunk money saved towards loan start bringing balance enough could pay little half loan conversation dad think hold money since know going happen covid reason idea student loan class get forgiven something feel utopic best also tempted spend money payment apartment live home hold saving take advantage grace period operate usual start paying balance advice input appreciated,0,0,0.01837947740792127,TN
2300,advice buying home hello live suburb portland oregon landlord want sell house currently renting landlord honor lease signed july find new place live trying save payment really fancy moving another rental interest rate low portland housing increasing much nyt calculator say would worth buy pretty good financials two u annual gross income k tax take home roughly month two u u contributing retirement using matching reach monthly pay student loan car payment income based repayment plan loan hopefully get student loan forgiveness paying loan fast basically k student loan payment roughly k roughly k saving month expense using current rent k okay dipping emergency fund little house necessary credit score everything considered assuming payment get traditional loan look another rental instead seem completely idiotic buy without assuming market continues go even slows little next year average house climbed able remove pmi probably faster could save anyway budget thinking le k seems slightly arbitrary extreme home body prefer home go even outside covid time live pnw going often hiking beach day trip bought new car last november good awhile want nice house know first house tempering expectation feel like probably position buy something nicer starter house advice welcome thanks time,0,0,0.012286394577663543,TN
1870,inherited trust parent passed question regarding mortgage v loc trust hey pf thanks reading year back father died left small inheritance year passing inherited first three payment roughly k young adult little credit newly secured job used towards payment house worked trust attorney open line credit total value trust k remaining amount owed home k essence trust lender v bank rate k loc working secure job operation making monthly loc payment roughly building saving cut today work since march recently started back making making pre covid different location mile round trip home home worth nearly k purchased year ago meaning sell near market value minus realtor fee nearly k equity original k put currently month away paycheck jobless buffer usually like keep month frugality question two fold begun realize although structure loc allowed save money short term nothing term building equity home loc payment go poof going principle would make financial sense sell home use k put home closer work secure low interest rate start monthly payment contributing equity use remaining k emergency rainy day fund help feel anxious living thin line uncertain time next question would financially wise remove loc trust enter traditional mortgage bank lending k able love pull k original k put use remaining equity k open loan bank,0,0,0.03022466420700494,TN
2192,recent unemployed college grad looking advice move back u title indicates looking advice best move back u anyone gone something similar u citizen lived left university uk good scholarship bsc comp sci degree graduated first still well gave good attempt find job uk due visa situation need someone willing sponsor entry level employee already quite limited sponsor covid mostly gave back u go grew midwest figure might try move chicago sure mistake family relative left k saving k student loan grace period december couple credit card year age always paid full month boa app say score though history course minimal worst shape hopefully know enough avoid might potentially shooting foot rent soon uk visa fly back say chicago stay hotel day looking cheap apartment job really anywhere else get roof head imagine hard get decent place without job even rent without income scare searching job midwest city luck far hear entry level job market mostly dead right economy still trying get back foot obviously keep trying internship belt least employable person thanks advice someone could give really know,0,0,0.01638529112079644,TN
39,way one protect country inflation rate invest stock asset invest local currency buy house k year worth thats gain every year year country inflation rate also year havent really made gain wondering way take cash invest order defend inflation amp x b know question open ill shorten order protect inflation year buy currency perform inflation amp x b example k dollar inflation year buy many euro outperforms dollar year ill making gain year logic behind investment correct buy currency order protect local currency amp x b thank,1,1,0.8859335724455418,TP
2893,privacy virtual card account suspended using privacy month every single online purchase subscription reason account got suspended even give reason suspended due security reason lol emailed unfortunately security reason unable disclose reason abuse prevention system human review team decided unable support account time discus decision like job firing saying sorry unfortunately security reason disclose reason got fired due system happened anyone able activate account really enjoyed using privacy especially subscription fact stay private well shopping,0,0,0.08339641506281738,TN
883,msft stock split likely chance msft splitting stock near future already seen gigantic company like aapl tsla split allow smaller investor purchase share stock split drive msft stock price higher short term split usually viewed good sign could reason msft would like avoid stock split split might actually happen msft wmt already know near closing deal bytedance acquire tiktok assuming successful msft stock price shoot already ath argue stock split make lot sense thought,1,1,0.973198589731703,TP
552,one year trading finally realized market controlled bank government fund via bond etf decide move asset price dump decide move asset price pump etf billion trillion make move favorable always control many people like refer whale like call shark retail investor u hope little fish swimming whale big investor biggest investor controller etf shark amp x b moving attention big boy onloading offloading anyone tool link please share,1,1,0.9300731005606334,TP
1617,college senior question hi college senior first gen low income background graduating spring mention point parent really opportunity gain financial literacy due raising kid sending remittance extended family member result feel like know much money saving parent stock source passive income currently reading book stock okay enough background graduating spring debt fortunate enough get job offer salary bonus k relatively cheap area frugal life always broke feel save pretty well question necessary step fresh year old college grad asap get ahead start becoming financially stable good resource personally found help reach goal preferably something unpopular find simple google search ight question might stupid ill ask anyway lmao mentioned earlier always frugal never really bought nice thing want buy car may priced little bit comfort zone price range would yall recommend would k unrealistic money saved right interning summer also looking weekend job well thanks,0,0,0.17465154820033313,TN
134,decline post modern megacity metropolis going potentially open opportunity suburban market seeing big city like nyc la shown long term financial practical unsustainability seems whole lot people starting consider change conception living moving investor would approach use possible opportunity p seems people really rush thinking reading commenting trying say somebody middle class living big city would many case like nyc la incredibly hard sustain talking sustainable city completely missed point,1,1,0.9234365154654447,TP
817,tesla order cancelled full disclosure total noob friday put limit order share tesla reasoning idea chaotic going monday wanted automate purchase much possible shit hit fan woke morning surprise order went threw already clicked see two share said share investigated learned see share hit monday ok cool got notification saying order cancelled money returned information given someone lecture edit ok get thank help downvoting learning come,1,0,0.2838586326062057,FN
1608,line credit promotion take hi k line credit account interest never touched bank promotion offering interest minimum amount k withdrawn loc year gravitating towards offer job unstable pandemic could take advantage loan case called bank agent told wanted activate offer declare much want take long want loan year advised could take full k loc lock year loan apply discounted interest year amount decide use always pay back loc promotion caveat know,0,0,0.019183832922002226,TN
2582,use blockfi interest account instead marcus hyse holding around k cash liquid rainy day fund marcus high yield saving account interest rate looking alternative startup ny came onto radar convert cash bitcoin ethereum usd stablecoin could earning interest capital compounding depending holding think would taking chance price fluctuation btc eth pretty stable though could put usdc stablecoin instead earning could earning still staying pretty liquid tying stock cd inflation time high putting saving crypto interest account might stable usd fiat think risky,0,0,0.33460492812943876,TN
1803,confused new job offer v staying current job graduated college got job big investment bank office raleigh nc area soon paying k pretty good benefit job compliance risk department risk analytics work role plan always move big city one year job dream well fast forward recently received offer smaller software company paying k yearly bonus making total take home pay around yearly quite good role business analyst position fully remote manager job said could work anywhere want u work nc month confused whether stay current job look analytics focused role base big city accept new job offer ann almost pay raise hard ignore plus learning new skill regarding business analyst position however afraid analytic skill marketable long term afraid losing analytic skill leaving current job plus bos team current job nice really need help right since people already left team feel horrible leaving confused realize good problem current climate want make right decision thought bringing counteroffer current bos everywhere read say good idea advice appreciated edit wanted add apply new job recruiter reached linkedin offered interview ended giving offer,0,0,0.0528220950449707,TN
2472,afford buy home hi everyone saving buy home renting area bit crazy bring home monthly k exact month spend around bill saved k thinking getting condo small home possible hoping keep around k saving emergency looking home range k k know ready yet buy least start looking around new posting add anything else needed,0,0,0.23051060636605078,TN
2221,advice handle purchasing essential new home hi everyone im buying home looking advice handle situation amp x b new home need obtain fridge washer dryer microwave essential cash saving account pay thing still money left also auto loan payed year finance appliance interest month pay truck estimation would appliance financed would cost le monthly vehicle half would drain fund set aside endeavor tl dr use saving pay vehicle finance appliance int keep paying vehicle loan pay cash appliance,0,0,0.01390373567896114,TN
509,invested k tqqq year ago would worth k today bit confused people hate tqqq yes extremely volatile general trend index like qqq vti likely increase year planning holding decade hold onto tqqq forget even exists retirement amp x b think qqq likely continue outperform amp p next year tqqq also similarly perform well think qqq likely much valuable year today logically tqqq would even valuable today well wondering missing something,1,1,0.7483980114812829,TP
1637,first time home buyer wife want purchase first house hopefully soon anchorage alaska work full time make hour make average around hour every two week paid bi weekly believe anyone idea big mortgage afford tip first time home buyer help would much appreciated thanks,0,0,0.056372570179550066,TN
1952,credit card debt killing please help sure million post day loss sure currently credit card debt k kept divorce kept debt avoid alimony payment another k legal fee keep partial custody kid various amount spent bill top paying nearly month car insurance payment yes terrible idea cant even sell car underwater pay nearly month ex child support well provide health insurance great job roughly k per year living paycheck paycheck barely keeping head water would debt consolidation loan good idea cant qualify one unless something crazy like apr really viable co signer debt relief numerous company see provide worth think qualify bankruptcy help would greatly appreciated would like detail would happy provide thank advance,0,0,0.02764624697533369,TN
2878,finance lease buy old new car hi made los angeles without car five year lately lyft uber painfully slow bos asking return office work moved covid public transportation looking le appealing commute jumped two train min bus two train min purchased old toyota may got stolen within month take proper precaution currently k cash ask dad money wondering buy another old car cash buy new lease today credit score good zip code first time ever asked financial advice please kind thank much heart,0,0,0.14530259194094042,TN
2617,became co owner house mother weird situation found would like get feedback four year ago parent bought house western u mortgage whatsoever past two year living said house rent free able remain debt free well build ten thousand dollar saving investment etc brother living recently live couple week ago due personal reason parent side decided would best change deed house officially mother would two name title went county recorder office everything seemed nice official far could tell mortgage house financial situation good probably would passed offer stand fully willing able assume responsibility home sole owner advice move forward already earmarked fund budget saving account homeowner specific expense hoa homeowner insurance property tax etc point near future planning talking parent possibly sole owner house seeing lot potential issue co ownership anything else worried,0,0,0.03176954225931017,TN
856,thought big company hit hard covid still hopefully rule market crashed fortunate enough buy handful stock nearly perfectly bottom bought thing like sixflags carnival cruise line delta airline boeing addition stuff le directly affected sold right would stand make pretty good profit probably averaging around return purchase thing time bought dropped sooo far seemed like would definitely bounce back eventually starting wonder good chance bounce back year maybe ever get back maybe take profit get better investment maybe would better initially getting stock crashed directly tied virus several stock higher crash hindsight guess hand maybe stock like still quite bit since thing like air travel cruise etc really gotten back swing good thing add money start climb thought sector like airline cruise line theme park etc upcoming year,1,1,0.8865431208091045,TP
2003,collection account process buying house watching credit closely got notification today logged see new collection company carry acct number date amount owned remaining also identical heck likely going get sorted never received anything mail regarding account collection company called helpful demanded admit debt mine pay immediately owed small balance hospital stay dec jan making monthly payment hospital balance,0,0,0.08019702512325994,TN
1615,really young personal assistant started working couple month ago working job craigslist new york area made far three month today got new job personal assistant parent familiar system work suspicious description mention receiving package sending place making donation run errand pay bill etc pay errand deposit made bank account money order sent mail deposit account received rest run whatever errand need affect tax college application process think would need learn tax early concerned also could affect fasfa application weli dealt large amount money like keep mind started would love keep job could change lot feel like well instead work hour amazon warehouse job also report expense account officer important detail grateful anything know useful information use later edit deposit check going rip block contact employer,0,0,0.012242977681447588,TN
2772,k strategy conservative already bond feel age aggressive hi currently late contributing roth k company match match year due covid salary right around k mark want get number closer eventually maxing roth ira well money hsa hitting around salary saving happy currently question allocation k want aggressive since late allocated get bond completely biggest holding blackrock msci acwi ex cl vanguard instl idx trust blackrock extended fd cl k research pretty much large market cap stock portfolio large market cap reasonable remaining broken various international smaller market cap fund one real estate index see imgur link full breakdown flipside aggressive input appreciated thank full listing option,0,0,0.44617939359023495,TN
1462,problem used vehicle sure else seek help earlier year june financed vehicle jdbyrider vehicle looked like nice shape rust body new tire engine bay looked pretty good took test drive everything fine however even hour completing paperwork heading home vehicle broke highway dealership offered towed back behalf went picked next day took home since nothing trouble back repair shop time already go back th engine replaced nd visit one installed faulty well cannot get anything ticking noise coming within claim normal local dealer telling need fixed asap moment developed interal coolant leak likely due corrosion cant drive mile without refill year warranty feel nearly useless cant seem repair refuse take look noise becomes major issue cant keep going back forth car shop week time dealership hour live missed work day kind option talked offer repair service option edit add job year make model vehicle engine tick know normal sound well,0,0,0.08441004771076145,TN
1635,emergency fund investing path financial independence currently working emergency fund goal save k first k k emergency fund situation feasible since need move dad home dad toxic away goal amp x b thinking saving emergency fund start saving moving start investing thought also need move back home state need k moving fund,0,0,0.18368704441562167,TN
2846,explanation happens trading car loan hey considering trading current car subaru legacy truck current auto loan right k according kbb car worth k factor current car cost looking cost calculator potential truck right think exclude current car trade value section thanks,0,0,0.14125323580536014,TN
2488,use unsecured personal loan buy rv consolidate credit card debt planning purchase rv k model research found probably get unsecured loan higher interest rate fine higher rate due getting rv k bluebook value live rent utility free living rv using money would normally spend pay credit card totaled k reached end intro apr want pay wondering way get loan pay rv simultaneously use pay card also wondering good idea advice would much appreciated net income month total bill month excluding credit card rent utility insurance rv month loan payment credit score ish cosigner credit ish,0,0,0.015408996179379388,TN
