,lem_text,y_true,pred_y,pred_probs,c_matrix
671,billionaire protect minimal sipc coverage billionaire billion dollar trading brokerage like schwab fidelity etc brokerage go bankrupt sipc cover max k brokerage would billionaire lose huge amount money brokerage fail lose stock even different account would cover million,1,1,0.5494977581655056,TP
349,fed may target google chrome browser breakup google really getting angle house antitrust complaint focusing search dominance censorship doj investigation advertising market doj investigation search whatever state ag going focus sure divestiture chrome doubleclick web based advertising ecosystem would meaningful impact company many unknown right,1,1,0.6151579086276641,TP
1580,seeking advice offer company pay significantly currently make retirement option good current company compare two scenario let disregard job security vacation time benefit difference negligible big difference salary retirement question thought quite jumbled apologize one question leaving lower paying job seemingly better retirement would foolish key point stayed current job would take year minimum able earn salary new job offering know current job career track see salary given time increase retirement contribution current job probably still live comfortably done yet even though new job good retirement benefit higher salary would allow max k contribution remaining salary gross would still significantly higher make current job salary grows time employer fers contribution whereas new job maxed k contribution could never already gut tell current job would allow enjoy better retirement new job would allow enjoy still ok retirement know right financial expert current job salary contribution tsp elected fers required employer contribution tsp tsp match fers total yearly contribution job offer salary contribution k employer contribution k total yearly contribution like thought course love jump salary k going compromise retirement year old matter update found benefit close initially misinformed make even difficult new job week paternity v week day pto day able rollover v day vacation day sick currently rollover day vacation sick time never expires,0,0,0.09746112979279069,TN
1949,early withdrawal k account every month better hello everyone started working company match contribution k account make k year thinking contributing max trust k system believe k retirement fund safe year like invest company allows k roth k thinking withdrawing money come k account right away instead contributing anyone idea according calculation much better pay early withdraw penalty contributing instead contributing correct,0,0,0.3424981992059009,TN
2038,payday loan death spiral stop folk bad spot hawaii usa lot stupid desperate decision foolishly ignoring problem know fix stacked led point need make drastic change know get got payday loan addition ton debt payday loan draw bank account every week three part time job also pay every week pay minimum payday loan eat pay rent balance keep going way hole seems paying payday lender amp x b real problem bank fee every time account overdraft get charged pay addition loan charge set new bank account elsewhere put paycheck want close account loan draw people bank say account fully closed week ach transfer attempt draw reopen overdraft pay overdraft fee try close account also told ignoring overdraft abandoning account get blackballed check system able use account either happens know direct deposit paycheck offer paper check amp x b also borrowed friend pay bank initiate stop payment ach transfer work still charging bank say pay initiate borrow money pay new overdraft fee plus got enough food eat really anything sell come even money amp x b try,0,0,0.03322064410075885,TN
2684,stay usa move abroad financial independence job opportunity cost living debating whether staying u moving abroad would better financial independence job opportunity cost living u reaching absurd level big city suburb bit cheaper commute take lower salary le job opportunity boring le usa predictable overall safe country world however current cultural environment big city seem dangerous lot country u medium like hate also dating environment u reached absurdity well female highly elevated expectation compared female country overall pride usa country getting really hard make living job pay hour fill job application get interview small house cost wonder country absurd indeed requirement certification master year experience start k debated sweden tax seem ridiculous ukraine philippine vietnam choice however even though cost housing low country think reason salary lot lower u even though still seems easier buy house see many people levered debt country like ukraine country seems like language barrier would higher philippine vietnam would make harder find job anyone else issue language barrier country hard time finding job lastly would easier harder find job country country abroad compared u salary country would easier make living country u would rate country best worst financial independence fire lifestyle cost living quality life usa ukraine sweden vietnam philippine,0,0,0.0999873781931837,TN
200,tesla weekly analysis ep week ending technical analysis tesla stock week interesting price target upcoming earnings week bull bear case scenario think got bearish momentum today definitely see card mentioned video analysis pretty solid imo also good watch missed tesla news week including tesla full self driving beta release next tuesday tesla battery supplier lg chem expected report record q profit tesla debt rating upgrade near investment grade ron baron cnbc interview tesla become trillion company,1,1,0.721119725648206,TP
1143,advice debt hi everyone single mother working full time suffer mania make saving money really difficult also ocd budget never stick something always come mania ruin make year went divorce last year ruined credit due taking payday loan interest rate ex husband want start saving feel like get pay every check loan credit get consolidation loan credit card limit use gas car loan advice get passed mania spending option consolidate loan help appreciated k started well,0,0,0.005151298645611388,TN
1757,company rsu award sell tax hello investing experience come working class family bad money barely understand tax well work large company great stock benefit lot stock award vest default option sell tax really understand thats stupid thing hold stock pay tax eoy whether pay amount come tax time pay le tax time sell need hire someone help understand,0,0,0.2972554295650998,TN
2845,tool track subscription hi everyone looking tool easy track subscription moment use tool called trackmysubs bit clunky web application lack app iphone also interface sometimes slow feature like tool alert fully customize unlimited number subscription convert subscription based another currency euro automatically setup tag category subscription tool roughly also app great user experience thanks,0,0,0.4924648432107008,TN
2745,keep getting call amazon delivery driver past month getting call delivery driver across country uk home phone say package want deliver find address always city mile away u gotten point playing amazon bingo trying guess next driver calling figure happening sort scam think curious concerned would appreciate info might happening,0,0,0.2773550695457727,TN
2090,need advice k first real job allowed set k day going roth k opposed pretax employer match guess question put target retirement like would putting like amp p rest target retirement good idea heard target retirement sre nothing though relatively new basically understand difference traditional roth edit make k year thinking matching dont school debt vehicle debt right,0,0,0.20475143721154815,TN
2628,hr posted job opening position mine salary range see bottom third use negotiating next raise promotion looking recent job posting company came across one job title level currently instead standard pay level code included pay range k started position right school noticed bottom range thousand lower limit first received job offer told salary negotiation could done since fresh grad got standard compensation package since coming year later fall gotten bonus put little le k lower limit also expecting promotion early next year bos mentioned time want make sure set prepare candidate promotion knowledge still within bottom third existing pay level use information help maximize raise receive promotion expecting upper limit existing pay grade like sell short understand sticking company sell short already especially start base salary right school,0,0,0.052610996500278714,TN
834,help understand spacs hey experience additive manufacturing realm know feel strongly company desktop metal great investment profitable company announced reverse ipo acquisition trine trne buy trne get converted desktop metal stock buying trne give right buy desktop metal stock certain price,1,1,0.9712760254118143,TP
23,biotech bcli risky cheap bcli keep making great hiring move partnership big reveal phase result approach stock dived earlier week reason could found news cycle common theory dip bear raid hypothesis somewhat validated overnight market somebody bought million dollar worth stock since creeping excerpt gt october brainstorm cell therapeutic inc nasdaq bcli announced agreement catalent inc ctlt manufacture nurown currently evaluated phase clinical trial patient amyotrophic lateral sclerosis al agreement call catalent produce cgmp clinical supply nurown new square foot cell therapy manufacturing facility houston tx upon fda approval nurown anticipate company extending agreement include production commercial supply nurown facility gt exciting development company anticipate patient demand high phase clinical trial successful nurown approved fda thus high quality manufacturing partnership place show brainstorm serious meeting demand letting access therapy issue patient gt stock sell unwarranted gt following release q financial result brainstorm stock decreased approximately discernible reason q conference call company reaffirmed result phase al trial available end november know change schedule past week unusual stock highly volatile ahead binary data readout view phase al result heard concern investor recent price drop represented possible unblinding data however correct study remains blinded schedule releasing result remains believe investor understand risk upcoming data readout could use recent sell buying opportunity gt conclusion gt manufacturing agreement catalent great news company patient alleviate likely significant demand nurown upon approval next expected news company topline data release phase al trial result expected end november change model valuation remains per share anxiously await result phase al trial,1,1,0.9744113563123764,TP
994,free cash flow question biotech calculating fcf follows fcf net income capex seems accepted equation however recently came across biotech company negative cash investing come section investment included calculation fcf surely spent cash investment earned back loss affect fcf company question capex pp amp e cash flow statement investment actually entail case security sure company would spending cash security rather capital balance sheet majority asset short term investment normal biotech someone could explain financials would helpful link company financials thanks advance,1,1,0.8765065761151116,TP
2552,need help toughest decision life sorry advance grammar un organized nature post within next week make toughest decision life could use advice year old currently member operating engineer union philadelphia member month last week received offer member ibew allentown two year tried get ibew denied never plan operator opportunity came knocking took onto financial aspect operator journeyman due previous experience mean max hourly rate already hourly rate hr overtime average yearly salary probably around take home hr annuity pension gross wage time retire work hour week year pension would around per month also full medical benefit ibew would go year apprenticeship starting max rate increase every year read journeyman rate hr much overtime average salary journeyman around take home annuity hr pension lackluster told percent told work year hour per year pension would month full medical also thing know would enjoy electrician much commute would minute max whereas operator drive hour way also electrician many overtime opportunity operator work overtime almost everyday blessing curse wife want move closer philly option guess trying say chase money operator comfort happiness electrician really lost pick thanks anyone read jumble mess offer guidance,0,0,0.12136179816889574,TN
342,thought parabolic move today seem news catalyst today dollar index dxy completely flat confirming move vix also large positive day bond market closed columbus day effect honestly looking lot like big tech short squeeze given biggest tech name moving biggest today think explanation,1,1,0.951060629409956,TP
2946,way avoid capital gain currently position plan holding long term want sell however want suffer capital gain tax according schwab brokerage able move position individual brokerage account roth possible move position sell suffer capital gain tax plan moving fund back individual brokerage,0,0,0.1188259408180862,TN
1706,dad may stolen identity best way check identity theft credit history hi everyone apology advance relevant sub post looking help get community always wonderful getting started graduated college last year working first real job grew without model financially responsible adult trying best starting notice issue worried might totally screwed even really getting started making big hallmark purchase car house etc dream worked throughout school never made enough money file tax year first time filing like everyone else lot going around time original deadline filed extension submitting return october received notification return rejected another return already filed ssn understanding almost always indicator identity theft fear panic ensue start thinking exactly someone would could information heard horror story thief filing fraudulent credit report opening financial account destroying someone credit realize anything wrong thing zero credit history lucky enough receive combination scholarship financial aid take student loan always terrified opening credit card watching way bad credit wreaked havoc parent life trying panic thought would good idea check credit report make sure credit history empty potential identity theft ongoing severe problem entering detail annualcreditreport com none bureau could pull report expected hoped equifax asked question several loan potentially made name dating back dad history opening loan mom name carrying act financial destruction point credit essentially ruined mom always warned may try thing sibling get older concrete evidence tried open loan name file return information unfortunately possibility position outright ask almost certainly lie grown ups life talk starting feel increasingly overwhelmed go circle government website pointless hotlines irs credit bureau seem require credit card information loan line credit order anything online pretty much request make conducted mail go mail necessary massive hassle guess generally looking advice next step situation main question way confirm duplicate tax return definitely identity theft going whole process reporting paranoid may somehow submitted return earlier forgotten likely loan equifax asked real decent chance throwing since much information would situation best way tackle hard gauge serious freaking love hear insight similar experience thank thank thank advance tl dr filed first tax return year got notice return already submitted ssn credit history worried dad someone else may stolen information submitted fraudulent tax return taken loan name know sure victim identity theft best way go,0,0,0.01375153898209261,TN
2485,refinance two year year mortgage see refinance rate anywhere year refinance currently owe k mortgage bought condo k current value roughly k current rate living least two year intention renting moving seems like brainer refinance sure thinking everything guidance would greatly appreciated,0,0,0.22990814191400918,TN
58,tesla crush q earnings record profit tesla nasdaq tsla third quarter earnings saw electric car maker post billion revenue beating wall street expectation result discussed length update letter released closing bell wednesday october tesla third quarter impressive electric car maker producing total vehicle comprised model model x model model company also delivered vehicle comprised model model well model model x tesla strong q result likely due model ramp united state increasing model production gigafactory shanghai expectation high tesla would post profit third quarter following key point tesla q update letter revenue tesla reported revenue billion third quarter beating wall street expectation comparison wall street expected tesla q revenue billion per factset consensus earnings tesla shareholder saw non gaap earnings per share third quarter comparison wall street expected tesla report gain per share estimize number bit optimistic per share,1,0,0.4897572589645972,FN
1505,check privately sold preferred share issued hello reddit supposed buying preferred share company called sunopta ticker stkl supposed coming via certificate preferred share mail company called pacific stock transfer co vega nv called said company would canadian company called tsx trust service trying get ahold tsx find transfer agent might skeptical share supposedly registered name w sec monday paid today anyway verify definitely starting seem like scam even though guy known real life month supposed paying friday anyone could help would greatly appreciated,0,1,0.8533359492804885,FP
959,rate super growth tech portfolio im thinking creating diversified tech portfolio high growth potential recommendation comment idea portfolio splunk atlassian service salesforce paypal adobe facebook google microsoft amazon apple square nvidia cloud wisdom tree,1,1,0.7935662572049649,TP
923,gamestop experienced massive short squeeze know gamestop likely long world frankly think good world investing standpoint look like massive potential investing opportunity amp x b volkswagen float shorted exploded short squeeze went x value extremely short period time gamestop float shorted amp x b look like noticeable price change would cause vastly larger short squeeze volkswagen one know totally crazy guy big short owns gamestop evidently company shorted like year many shorter position caught way would need go lot start triggering margin call something else understanding earnings call coming feel like could catalyst good earnings call,1,1,0.9149420422741674,TP
11,purchased four clean energy index fund anticipation joe biden win would concern strategy strongly believe biden win debate last night said going get rid oil company today campaign clarified meant subsidy big oil clean energy index purchase made total people analysis behind ace pbw focused north america see largest gain check back may evaluate smart concern would ishares global clean energy etf icln lowest er three standing globally diversified icln contains holding top holding account fund american global top country u china new zealand basic preliminary knowledge country economic political situation helpful fund contains ton core renewable stock biofuels ethanol geothermal hydroelectric solar wind devoid tech built renewables ev seem talk town nowadays fund follows amp p global clean energy index market cap weighted overall fund focus core component renewable energy first trust nasdaq clean edge green etf qcln one similar icln globally diversified fund second lowest er three standing interested american renewable concentration may contender qcln u weight top country u china canada fund follows nasdaq clean edge green energy index hold stock top account whole fund fund similar icln though containing difference icln focus core renewable energy whereas qcln focus core renewable energy tech built renewables tech built renewables would consist technology ev light emitting diode supported company like tsla nio oled alp clean energy etf ace one little different ace highest er three standing fund globally diversified focus canada u fund follows unique index known nacex index focus u canadian clean energy market cap weighted top holding account etf similar qlcn core renewable energy tech built renewables minus global diversification ultimately fund north american focused renewable energy index fund invesco winderhill clean energy etf pbw pbw track wilderhill clean energy index includes stock company involved clean energy conservation top holding include enph tsla nova inception date pbw march aum million expense icln qcln ace buy vfiax clean list publicly traded company leading way solution transition clean energy invesco solar etf tan year trailing total return expense ratio annual dividend yield month average daily volume asset management billion inception date april issuing company invesco etf track mac global solar energy index comprised multi cap company involved aspect solar energy industry based around world though primarily u china company hold around u international stock tan top holding include solaredge technology sunrun solar power company enphase energy inc enph first trust ise global wind energy index fund fan solar energy may first alternative energy source people think reality wind turbine alone account total energy generation u par nuclear capacity hydroelectric power capacity significantly ahead share solar problem investor many wind company fan etf wrap biggest dedicated play like denmark based vesta vwsyf well firm like general electric co ge major producer wind turbine related technology together component represent big potential wind energy spdr msci acwi low carbon target etf lowc side firm focused green energy natural product end user,1,1,0.7798864076301567,TP
2244,taking goldman sachs marcus loan cc debt help credit score quickly unemployed due covid prior job making k yr health scare car issue wanting deplete cash hand ran credit card k past month saving fall back fully expect employed soon offer turn due location reason believe making similar salary said done need increase credit score asap wondering consolidating via goldman sachs marcus would help credit score go beyond continuing make minimum payment employed pay bigger chunk quickly assuming course charge anything else credit card paid make loan payment regularly thanks,0,0,0.007586127591165607,TN
1240,retirement annuity whats catch annuity jackson guaranteed withdrawal relative invested lifeguard freedom flex told mean account guaranteed return least mater market performs also quarterly step one quarter better say return others fund balance go fee around still give guaranteed return matter better saving bond feel like rolling traditional ira better option like guaranteed return feel like missing something hoping point,0,0,0.1682016543686488,TN
